{
 "end": {
  "reason": "evidence_ended",
  "text": "The measured trail ends here."
 },
 "final_multiple": 3.8,
 "n": 0,
 "rounds": [
  {
   "answer": "c",
   "answer_qid": "Q999990013",
   "caption": {
    "source": "template",
    "text": "TEST caption: Test Answer Place One is linked from Test Seed Article; it ran 6.2x its normal readers the day after."
   },
   "evidence": {
    "badge": "flowed",
    "clickstream": {
     "clicks": 12345,
     "month": "2026-08",
     "rank": 3
    },
    "cross": [
     {
      "label": "TEST: mentioned on TV news captions",
      "multiple": null,
      "source": "gdelt_tv",
      "when": "after",
      "z": 3.4
     }
    ],
    "fluke": 0.08,
    "fluke_1_in": 12,
    "fluke_warming": false,
    "linked": true,
    "p_time": 0.026,
    "placebos": 38,
    "split_ok": true
   },
   "i": 1,
   "options": [
    {
     "calm": true,
     "id": "a",
     "lag_days": null,
     "median": 900,
     "multiple": 1.04,
     "qid": "Q999990011",
     "spark": [
      841,
      816,
      784,
      975,
      927,
      1073,
      946,
      974,
      1050,
      987,
      1000,
      919,
      841,
      932,
      980,
      1002,
      914,
      929,
      964,
      763,
      876,
      917,
      892,
      828,
      858,
      824,
      984,
      952,
      846,
      910,
      895,
      917,
      890,
      1003,
      999,
      786,
      847,
      951,
      967,
      855,
      854,
      887,
      852,
      754,
      950,
      773,
      879,
      917,
      791,
      978,
      795,
      909,
      1003,
      953,
      892,
      864,
      1008,
      860,
      952,
      937,
      881,
      898,
      847,
      902,
      888,
      1045,
      959,
      874,
      947,
      973,
      857,
      983,
      1004,
      978,
      969,
      934,
      927,
      809,
      932,
      865,
      935,
      948,
      860,
      884,
      747,
      955,
      950,
      940,
      891,
      919
     ],
     "timing": null,
     "url": "https://en.wikipedia.org/wiki/Test_Decoy_Place_A",
     "z": -0.34
    },
    {
     "calm": true,
     "id": "b",
     "lag_days": null,
     "median": 1300,
     "multiple": 0.9,
     "qid": "Q999990012",
     "spark": [
      1262,
      1487,
      1265,
      1274,
      1303,
      1304,
      1326,
      1205,
      1220,
      1104,
      1280,
      1335,
      1401,
      1364,
      1140,
      1472,
      1325,
      1263,
      1225,
      1257,
      1100,
      1312,
      1304,
      1213,
      1127,
      1200,
      1541,
      1364,
      1444,
      1170,
      1411,
      1322,
      1303,
      1251,
      1363,
      1276,
      1322,
      1278,
      1389,
      1224,
      1207,
      1340,
      1555,
      1367,
      1387,
      1075,
      1280,
      1274,
      1337,
      1314,
      1202,
      1259,
      1198,
      1229,
      1257,
      1362,
      1322,
      1258,
      1360,
      1331,
      1322,
      1191,
      1252,
      1180,
      1383,
      1375,
      1396,
      1222,
      1357,
      1177,
      1327,
      1319,
      1276,
      1244,
      1266,
      1089,
      1274,
      1158,
      1385,
      1288,
      1500,
      1313,
      1515,
      1353,
      1369,
      1374,
      1271,
      1438,
      1354,
      1228
     ],
     "timing": null,
     "url": "https://en.wikipedia.org/wiki/Test_Decoy_Film_B",
     "z": -0.05
    },
    {
     "calm": false,
     "id": "c",
     "lag_days": 1,
     "median": 800,
     "multiple": 6.2,
     "qid": "Q999990013",
     "spark": [
      721,
      796,
      799,
      802,
      870,
      914,
      758,
      788,
      788,
      886,
      810,
      788,
      744,
      708,
      803,
      814,
      773,
      871,
      826,
      836,
      750,
      809,
      802,
      700,
      828,
      733,
      808,
      846,
      822,
      849,
      844,
      737,
      792,
      820,
      846,
      800,
      900,
      737,
      867,
      803,
      822,
      773,
      742,
      829,
      816,
      820,
      910,
      940,
      967,
      755,
      931,
      809,
      894,
      719,
      846,
      803,
      847,
      786,
      717,
      905,
      734,
      905,
      810,
      655,
      748,
      794,
      759,
      803,
      755,
      806,
      871,
      906,
      807,
      898,
      885,
      809,
      732,
      810,
      758,
      964,
      812,
      941,
      781,
      860,
      777,
      866,
      784,
      4825,
      2941,
      2039
     ],
     "timing": "after",
     "url": "https://en.wikipedia.org/wiki/Test_Answer_Place_One",
     "z": 7.1
    },
    {
     "calm": true,
     "id": "d",
     "lag_days": null,
     "median": 700,
     "multiple": 1.06,
     "qid": "Q999990014",
     "spark": [
      649,
      712,
      745,
      729,
      704,
      774,
      782,
      711,
      738,
      724,
      660,
      697,
      671,
      742,
      738,
      658,
      745,
      628,
      779,
      648,
      724,
      672,
      771,
      703,
      706,
      621,
      673,
      763,
      863,
      643,
      780,
      674,
      754,
      707,
      682,
      824,
      641,
      842,
      621,
      638,
      732,
      666,
      668,
      801,
      647,
      754,
      672,
      708,
      769,
      714,
      715,
      769,
      652,
      767,
      721,
      580,
      690,
      643,
      696,
      763,
      631,
      746,
      658,
      599,
      776,
      661,
      703,
      720,
      619,
      769,
      608,
      783,
      620,
      710,
      721,
      720,
      685,
      760,
      590,
      756,
      722,
      722,
      748,
      648,
      617,
      633,
      693,
      744,
      712,
      800
     ],
     "timing": null,
     "url": "https://en.wikipedia.org/wiki/Test_Decoy_Place_D",
     "z": 0.66
    }
   ],
   "shared_trigger_stop": false
  },
  {
   "answer": "a",
   "answer_qid": "Q999990021",
   "caption": {
    "source": "wikipedia",
    "text": "TEST caption from a Wikipedia short description (fixture)."
   },
   "evidence": {
    "badge": "spiked_after",
    "clickstream": null,
    "cross": [],
    "fluke": 0.02,
    "fluke_1_in": 50,
    "fluke_warming": false,
    "linked": true,
    "p_time": 0.03,
    "placebos": 38,
    "split_ok": true
   },
   "i": 2,
   "options": [
    {
     "calm": false,
     "id": "a",
     "lag_days": 0,
     "median": 1500,
     "multiple": 2.4,
     "qid": "Q999990021",
     "spark": [
      1393,
      1117,
      1637,
      1539,
      1582,
      1408,
      1363,
      1461,
      1495,
      1687,
      1464,
      1405,
      1498,
      1421,
      1393,
      1574,
      1496,
      1659,
      1444,
      1420,
      1773,
      1627,
      1556,
      1365,
      1655,
      1634,
      1430,
      1327,
      1434,
      1618,
      1362,
      1455,
      1499,
      1725,
      1473,
      1626,
      1566,
      1432,
      1280,
      1506,
      1523,
      1561,
      1441,
      1594,
      1563,
      1401,
      1453,
      1385,
      1442,
      1509,
      1407,
      1458,
      1661,
      1335,
      1638,
      1322,
      1422,
      1446,
      1564,
      1294,
      1481,
      1777,
      1436,
      1831,
      1380,
      1507,
      1634,
      1495,
      1382,
      1542,
      1569,
      1727,
      1609,
      1413,
      1807,
      1426,
      1641,
      1368,
      1705,
      1341,
      1406,
      1381,
      1553,
      1553,
      1539,
      1451,
      1610,
      1483,
      3555,
      2661
     ],
     "timing": "alongside",
     "url": "https://en.wikipedia.org/wiki/Test_Answer_Film_Two",
     "z": 4.3
    },
    {
     "calm": true,
     "id": "b",
     "lag_days": null,
     "median": 1100,
     "multiple": 1.0,
     "qid": "Q999990022",
     "spark": [
      875,
      1233,
      1022,
      1213,
      1184,
      1251,
      1229,
      1100,
      1147,
      1143,
      1196,
      1116,
      1012,
      1089,
      1076,
      1154,
      999,
      1172,
      1011,
      1169,
      1152,
      1069,
      1156,
      994,
      926,
      1048,
      1047,
      1046,
      1169,
      1167,
      979,
      1130,
      1006,
      1030,
      1034,
      1150,
      1030,
      1038,
      1079,
      1132,
      1084,
      1145,
      1082,
      968,
      1035,
      1107,
      1093,
      1163,
      1247,
      1117,
      1155,
      987,
      994,
      968,
      1085,
      1323,
      1139,
      1187,
      1145,
      1077,
      1150,
      1124,
      1001,
      1078,
      1122,
      934,
      1177,
      1050,
      925,
      1246,
      1039,
      966,
      978,
      1078,
      1078,
      1229,
      1005,
      979,
      1204,
      1045,
      1074,
      1070,
      1179,
      1029,
      1223,
      1166,
      1023,
      1096,
      1191,
      1044
     ],
     "timing": null,
     "url": "https://en.wikipedia.org/wiki/Test_Decoy_Film_E",
     "z": -0.08
    },
    {
     "calm": true,
     "id": "c",
     "lag_days": null,
     "median": 2600,
     "multiple": 0.99,
     "qid": "Q999990023",
     "spark": [
      2849,
      2725,
      2547,
      2885,
      2622,
      2625,
      2759,
      2470,
      2378,
      3064,
      3161,
      2498,
      2645,
      2772,
      2566,
      2470,
      2736,
      2584,
      2512,
      2827,
      2731,
      2491,
      2487,
      2459,
      2794,
      2842,
      2171,
      2929,
      2531,
      2504,
      2705,
      2716,
      2449,
      3036,
      2562,
      2796,
      2780,
      2674,
      2867,
      2550,
      2506,
      2240,
      2580,
      2543,
      2494,
      2428,
      2185,
      2580,
      2467,
      3123,
      2578,
      2445,
      2323,
      2509,
      2149,
      2195,
      2685,
      2813,
      1980,